[
  {
    "id": "in_situ",
    "name": "Измерение на месте",
    "oneLiner": "Прибор доставляют прямо туда, где нужно измерить, — на поверхность или в атмосферу.",
    "explainer": "Аппарат садится на поверхность или спускается сквозь атмосферу на парашюте. Термометр, барометр и другие датчики измеряют всё вокруг, как метеостанция на Земле. Это самый прямой способ узнать температуру, давление и состав. Но и самый трудный: на Венере посадочные аппараты выдерживали жар и давление совсем недолго.",
    "measures": ["температура", "давление", "состав атмосферы", "состав грунта"],
    "interactive": null,
    "missionIds": ["venera7", "venera9", "viking1", "viking2", "spirit", "curiosity", "huygens", "galileo", "apollo"]
  },
  {
    "id": "radar",
    "name": "Радар",
    "oneLiner": "Радиоволны пробивают облака и дымку, а их эхо рисует карту поверхности.",
    "explainer": "Аппарат посылает к планете радиоволны и ловит их отражение. Радиоволны проходят сквозь облака и дымку, которые не пропускают обычный свет. По времени, за которое возвращается эхо, узнают высоту гор и глубину впадин. По силе эха понимают, какая там поверхность: гладкая, шершавая или жидкая. Так «Магеллан» составил карту Венеры, а «Кассини» нашёл моря на Титане.",
    "measures": ["рельеф", "свойства поверхности"],
    "interactive": null,
    "missionIds": ["magellan", "cassini", "lro", "europa_clipper", "juice"]
  },
  {
    "id": "ir_radiometry",
    "name": "Инфракрасная радиометрия",
    "oneLiner": "Тёплые тела светятся в инфракрасном свете, и по этому свечению измеряют их температуру.",
    "explainer": "Всё тёплое излучает инфракрасный свет, невидимый для глаза, — на этом работают тепловизоры. Радиометр измеряет, сколько такого света идёт от поверхности. Чем поверхность горячее, тем ярче она светится в инфракрасном диапазоне. Так узнают температуру дневного Меркурия или холодных кратеров на полюсах Луны, не прикасаясь к ним.",
    "measures": ["температура поверхности"],
    "interactive": null,
    "missionIds": ["mariner10", "lro", "cassini", "bepicolombo", "europa_clipper", "jwst"]
  },
  {
    "id": "spectroscopy",
    "name": "Спектроскопия",
    "oneLiner": "Свет раскладывают в радугу и по тёмным и ярким линиям узнают, из чего состоит вещество.",
    "explainer": "Свет раскладывают на цвета, как в радуге, — это называется спектр. Каждое вещество поглощает или излучает свет только на своих особых цветах. Поэтому в спектре появляются тёмные или яркие линии, похожие на штрихкод. По этим линиям узнают, из чего состоят атмосфера или поверхность, даже с огромного расстояния.",
    "measures": ["состав атмосферы", "состав поверхности"],
    "interactive": null,
    "missionIds": ["messenger", "new_horizons", "cassini", "galileo", "curiosity", "jwst", "europa_clipper", "juice"]
  },
  {
    "id": "radio_science",
    "name": "Радиоизмерение гравитации",
    "oneLiner": "Частота радиосигнала аппарата чуть сдвигается, когда его тянет гравитация, — так строят карту притяжения.",
    "explainer": "Аппарат посылает на Землю радиосигнал на очень точной частоте. Когда притяжение планеты чуть ускоряет или замедляет аппарат, частота сигнала немного сдвигается. Это эффект Доплера — тот же, из-за которого сирена проезжающей машины звучит то выше, то ниже. По крошечным сдвигам вычисляют, где притяжение сильнее, а где слабее. Спутники-близнецы GRACE и GRAIL делают похожее: они измеряют, как меняется расстояние между ними.",
    "measures": ["гравитационное поле", "масса", "внутреннее строение"],
    "interactive": null,
    "missionIds": ["grace", "grail", "juno", "magellan", "messenger", "cassini", "bepicolombo", "juice"]
  },
  {
    "id": "radio_occultation",
    "name": "Радиопросвечивание",
    "oneLiner": "Радиосигнал аппарата проходит сквозь атмосферу планеты и приносит её «отпечаток».",
    "explainer": "Аппарат уходит за планету, и по пути к Земле его радиосигнал проходит сквозь атмосферу. Атмосфера преломляет и ослабляет сигнал — тем сильнее, чем она плотнее. По тому, как менялся сигнал перед тем, как пропасть, вычисляют давление и температуру на разных высотах. Так «Вояджер-1» в 1980 году выяснил, что атмосфера Титана очень плотная.",
    "measures": ["давление", "температура атмосферы", "плотность атмосферы"],
    "interactive": null,
    "missionIds": ["voyager1", "cassini", "new_horizons"]
  },
  {
    "id": "kepler_mass",
    "name": "Масса по орбите спутника",
    "oneLiner": "Чем тяжелее планета, тем быстрее вокруг неё кружит спутник.",
    "explainer": "Чем массивнее планета, тем быстрее должен двигаться вокруг неё спутник на том же расстоянии. Астрономы измеряют, насколько далеко от планеты спутник и за сколько дней он делает полный круг. Законы Кеплера и Ньютона связывают эти два числа с массой. Так по орбите Харона узнали массу пары Плутон — Харон задолго до полёта «Новых горизонтов».",
    "measures": ["масса"],
    "interactive": "kepler_mass",
    "missionIds": ["new_horizons"]
  },
  {
    "id": "occultation",
    "name": "Покрытие звезды",
    "oneLiner": "Планета закрывает далёкую звезду, и по тому, как гаснет звезда, видно атмосферу.",
    "explainer": "Иногда планета или карликовая планета проходит точно перед далёкой звездой. Если атмосферы нет, звезда гаснет мгновенно. Если атмосфера есть, звезда гаснет постепенно, потому что её свет сначала проходит сквозь газ. Так в 1980-х годах с Земли обнаружили атмосферу у Плутона.",
    "measures": ["наличие атмосферы", "размер"],
    "interactive": null,
    "missionIds": ["new_horizons"]
  },
  {
    "id": "transit",
    "name": "Метод транзитов",
    "oneLiner": "Планета проходит перед звездой, и звезда чуть-чуть тускнеет.",
    "explainer": "Телескоп часами следит за яркостью звезды. Если планета проходит между звездой и нами, яркость падает на доли процента. По глубине провала узнают размер планеты, по промежуткам между провалами — длину её года.",
    "measures": ["радиус", "период обращения"],
    "interactive": "transit",
    "missionIds": ["trappist_telescope", "spitzer", "jwst"]
  },
  {
    "id": "ttv",
    "name": "Сдвиги времени транзитов",
    "oneLiner": "Соседние планеты притягивают друг друга и сбивают расписание транзитов — по сбоям находят массы.",
    "explainer": "Если у звезды несколько планет, они притягивают друг друга. Из-за этого планета проходит перед звездой то чуть раньше, то чуть позже точного расписания. По этим сдвигам вычисляют массы планет: чем массивнее соседка, тем сильнее она сбивает график. Так узнали массы планет TRAPPIST-1, которые слишком малы и далеки, чтобы взвесить их иначе.",
    "measures": ["масса"],
    "interactive": null,
    "missionIds": ["spitzer", "trappist_telescope"]
  },
  {
    "id": "magnetic_induction",
    "name": "Магнитная индукция",
    "oneLiner": "Спутник «отвечает» на магнитное поле планеты, если внутри у него солёный океан.",
    "explainer": "У Юпитера мощное магнитное поле, и его спутник Европа всё время движется сквозь него. Если внутри спутника есть слой, проводящий ток, например солёная вода, в нём возникают электрические токи. Эти токи создают собственное магнитное поле Европы. Магнитометр «Галилео» заметил такой «ответ» — сильный довод в пользу океана под ледяной корой.",
    "measures": ["проводящий слой под поверхностью"],
    "interactive": null,
    "missionIds": ["galileo", "europa_clipper", "juice"]
  }
]
